date,rating,review_text,thumbs_up_count,title
2025-11-23 03:57:58,1,"My order was cancelled within 5 minutes. According to Flipkart policy, if an order is cancelled before packing/shipping, the full amount INCLUDING platform fee must be refunded. I received only ₹206 instead of ₹213. Please escalate this issue to the appropriate team. I am not asking about the item amount, I am asking for the missing ₹7 platform fee which should also be refunded.",0,
2025-11-24 02:41:25,1,"What do you mean the COD is not responding to such a big online shopping?And its delivery is not fast. It is very late.What's the point of shopping online if you don't have to provide a code?And the quality of the product isn't great. I wonder how the ratings are read?This rating has increased. I made the product. Its quality is not that great.I want to say this: Make COD available to me!You enable this scanning in online cow insurance. After paying, you will lie and say you didn't receive the m",0,
2025-11-24 09:42:09,2,"Hi Flipkart Team, I purchased a Fastrack watch from Flipkart about 2 months ago, and it was delivered within 8 minutes of ordering. However, the watch has now stopped working and is not charging at all. I am very worried because I am unable to use it. Also, I have not received the invoice, even after trying multiple times. Without the invoice, I cannot claim any warranty or service. Please help me with: Providing the invoice for my order Assisting with repair or replacement of the watch",0,
2025-11-24 18:33:03,1,Do not use them. Other people had warned me but I gave them a fair shot at a simple order. They delayed delivery for a week every day a lame excuse on why the delivery partner couldn't deliver due to a problem at their end of some kind. The worst part is the diabolical customer service where for the first time the responses by their robot are better and more helpful than when the human representative arrives on chat. They just say we are sorry for the delay and keep pasting their one script.,0,
2025-11-25 10:03:44,1,"This is the worst app I have ever used, they fool people, they try to pose as they give us the products at lowest price by giving different offers and cashback unfortunately they are trying to fool us, no cashback no transparency, even they take your money without giving any service, I'll rate this app - 10 out of 10 instead you can use meesho app this is a perfect app for me and can be for you too.",0,
2025-11-27 07:07:39,1,"I regret buying a Thomson mixer grinder from Flipkart . It stopped working within a few months and I submitted it for warranty service over 3 months ago. Since then, there has been no update, no repair, no replacement. The authorised service centre never picks up calls, and support keeps saying they “don’t have any update.” I’ve wasted so much time following up, and still nothing has been resolved. This is the worst after-sales service I’ve ever experienced. Please think twice before buying.",0,
2025-11-28 09:06:51,1,very bad services don't buy any product from this platform. Flipkart 's help center doesn't help you. I ordered something from here and I faced a problem for installation for 3 months and in present the problem is not solved they are said to wait for 24 to 48 hours but it has been 3 months but the problem is not solved yet. now you can imagine how much I faced the problem,0,
2025-11-28 16:07:01,1,"I am extremely disappointed with Flipkart's return process. I ordered a pair of shoes and requested a return because they didn't fit. The Ekart delivery executive successfully picked up the return 2 days ago. I handed over the product myself. ​However, the Flipkart app is now showing that the ""Return Pickup was Cancelled"", which is a complete lie. ​Now I am in a situation where I don't have the shoes, and I haven't received my refund. This feels like a scam. I have lost both my money and product",0,
2025-11-29 08:02:19,1,They have started cheating money from customers. Due to unfit size i have returned the ordered item then agent pickup the item and after 2 days they assigned status amount refunded successfully but amount was not credited to account if I raise a query they are simply saying we have refunded check with bank. From past we feel flipkart is one of the best delivery app but now we feel it became one of the scammers,0,
2025-11-29 12:49:00,1,"To much bad service related to delivery, sometime It shows delivery rescheduled from your choice but we didn't rescheduled delivery and sometimes it shows your item is delivered but It is not . Their customer service is very poor they didn't understand our problems . One more thing is very bad about Flipkart that It freezes our account, means whenever we book any product apps cancel it automatically and after contacting with customer service they say this is glitch and didn't resolve problem",0,
2025-11-29 14:48:12,1,"I ordered a laptop and it was showed will be delivered within 2 days but it's been more than a week still I have not received and the amount was also paid, delivery partners are behaving like very roude they call and will be coming now and then after 2 hours they cancell delivery i never expected this kind of service from Flipkart. Also we have no option to call to anyone if we call to delivery partners the number will always comes busy only a d they never picks up the call.",0,
2025-11-30 05:31:28,1,"flipkart ❌The price shown on the product page appears low, but when you proceed further, the amount increases. This creates confusion and feels misleading. Kindly maintain transparent pricing. In my experience, Meesho👍 provides more consistent and honest pricing.”",0,
2025-11-30 07:16:03,1,"worst app ever. you cannot receive your product on time and you cannot return your product. no delivery agent will respond. customer care will attend your call and they will tell you like they will raise a complaint and no one will call you back. application is worst. many time it won't open and give you error message something went wrong. nothing will be updated properly. miscommunication, false promises like I will come today but no one comes to collect your order. A big 0 for Flipkart.",0,
2025-11-30 07:50:26,1,"It’s the worst platform I have ever used. There are so many issues with this app. Their service is terrible — they are never able to complete any delivery on time. Whether it’s express or normal, it always takes weeks. Customer care is also very poor. You’re forced to chat with an AI, and it feels like the AI decides whether it wants to respond to you or not",0,
2025-12-01 05:33:39,2,"I am facing an issue where all Flipkart products show “Not deliverable to your location” for the past few days. My location is Kolathur, Salem District – 636303. I used to receive deliveries regularly to the same address before, but suddenly delivery is not available. Kindly fix the delivery service for my location as soon as possible.",0,
