date,rating,review_text,thumbs_up_count,title
2025-11-21 14:42:21,3,"The app is really great but I’ve noticed a big problem with how WhatsApp handles screenshots. When I view a screenshot through my phone’s normal gallery apps like Google Photos or the built-in Photos app, the image is sharp and high quality. But the moment I open the exact same screenshot inside WhatsApp, the quality suddenly becomes lower — it looks more compressed and blurry. This makes it hard to view details clearly, especially for things like receipts, conversations, or important infos.",28,
2025-11-22 00:37:33,1,"Someone sent me a picture on WhatsApp. I got the notification. But when I entered the app and the chat, I didn't see the picture. The picture was fully vanished.. although my media visibility was on, storage was good enough. What's the reason for this?",28,
2025-11-26 17:19:46,2,"I hav a data of 20GB and im trying to take backup for the 1st time. I hav 2TB of space in my Google Drive. Im using 5G mobile net and tried to take backup, but was not successful. Then I tried with high speed WiFi but still was not successful. The data backup is not running in the background. The backup is processing only when the app is open and the lock screen is inactive. If the screen is locked, then the backup is not moving and staying at same MB uploaded state.",28,
2025-11-22 04:15:23,4,"the app is great I love it but PLEASE add a feature or prompting ""are you sure you want to close"" on view once media because I'm sure almost every one has accidentally opened a view once that closed it without hearing it or anything and it so awkward to ask for them to resend bro it's so annoying, and then for some reason mine shows them as opened even when I haven't",27,
2025-11-23 16:07:17,1,"Transferring chats from iOS was stressful: my iPhone only worked while charging via cable, and transfer required a cable to connect with the Android phone. Worse, my old Android - used previously for chat transfer to iOS - didn't support transferring chats back from iOS; only newer Android phones worked. There should be an easier, universal option for all devices!",27,
2025-11-24 03:31:07,1,earlier the about option was very good. we didn't need to change it at all.. but now the WhatsApp having latest update... the about is set to duration time.. which is so irritating... people's about has gone disappear.. u can't actually now support who has blocker u even cuz about is not showing 😂... so frustrating... it is.... I request whatsapp team to kindly reinstall that feature of about in which we don't have to change it and duration is not there...,27,
2025-11-16 16:00:42,4,"I don't know why but when I follow a channel, I noticed that after some period of time (I don't know how long), it stopped giving me update. And I know in fact they're still active because when I followed back the channel, all the information that I missed appears suddenly. Please fix this",26,
2025-11-22 14:06:32,2,"Multiple bugs and errors, Especially when it comes to backing up chats, usually will get stuck at preparing to be backed up on social storage, then stuck again when uploading, another issue is, linked devices usually don't have some contacts names changed even when the primary device has reflected the change of name.",26,
2025-11-25 10:08:20,1,"updated version not showing contact's about information. The contact list is coming like choosing the option. This setting is not good. And I don't know where to check my friend's ( status or about) information (busy, battery about to die, hey there I am using WhatsApp). And in the status section WhatsApp channel is coming. It's not good. For status and WhatsApp channels there should be separate sections.",26,
2025-11-22 22:06:45,1,"its a perfect messaging app sure... But the way they changed how the photo select or video select works is SUPER FRUSTRATING! Why does it need to have a pull up tab, just make it go to the Gallery like before.. Because everything is in order there/easy to find UNLIKE WHAT THEY DID WITH IT NOW!",25,
2025-11-24 10:52:41,3,"I work on WhatsApp on a computer. Since the latest update, you have removed the option to keep draft messages separate. I think this is very important for business reasons or when sending messages to many people at once. Kindly please bring it back in the next update. Thank you.",25,
2025-11-26 15:47:23,2,"A lot of bugs when scrolling up, the first scroll (when done too fast) jumps a few days back instantly. another bug is when old profile pictures still remain (not cache) when a new one is set by other users. Also dns resolution by this app is trash, i always get a notification that the app uses cellular data instead of wifi because your domains probably fail to resolve..",25,
2025-11-19 21:33:56,4,"Hello,I have a request regarding voice message playback in WhatsApp. When I’m listening to a voice message and I bring the phone close to my face, the screen turns off automatically and the audio switches to the front earpiece. This behavior is not always desirable for me, and I would like to keep the audio on the main speaker. It would be great if you could add an option in the settings so users can enable or disable this feature according to their preference. Thank you for your attention.",24,
2025-11-20 10:17:02,1,"WhatsApp randomly logged me out of my account, and when I tried to log back in, it demanded a Two-Step Verification PIN that I NEVER created. There was no warning, no explanation, and no real way to recover my account. Being told to simply “wait 7 days” is unacceptable for an app millions depend on. This is a serious failure in both security and user support. WhatsApp must fix this issue urgently.",24,
2025-11-23 16:17:12,1,"WhatsApp updates are getting worse day by day, all in the name of “privacy.” At least give us the option to choose whether we want these features or not. Channels, Communities—now so many unnecessary things are being added. I guess only reels are left to arrive now. We can’t even set our WhatsApp About freely anymore because of the frustrating word limit. Please stop forcing these useless updates on users. Kindly provide us the option to choose the features we want, instead of imposing them.",24,
2025-11-17 18:48:31,4,"hey, awesome an all, no complaints really. only problem was this newly added update of a duration to the bio. It's really stupid and unnecessary if you ask me. I recently edited my bio to add an emoji or smth and then the next day the bio was gone. Please can you make there be an option for it to be permanent instead of limiting it to a duration of a month or so. Some of us like to keep our bio for added contacts or even people who have gotten our number. Thank you.",23,
2025-11-19 05:49:30,3,"good well protected . love it. only problem it's a big one scamers love it! Everything else is really good. I mean from a to g, but the scammers put a big Damper on it. Unfortunately, because people that get scam won't import them. And even if you report them, they have a way of coming back, asked the unfortunate part, but I really command their responsibility, their awareness, and it's a good good app, but look at I don't know, I give them an extra start for scammers, I don't like them.",23,
2025-11-21 23:33:53,2,"after the newest update, the app wanted me to restore my chats, and so i did. but when it was around halfway done, it randomly crashed by itself and it doesn't restore all my chats, but instead, IT ERASES EVERY SINGLE CHAT i have with people. I don't lose their numbers or unfollow every channel like a full reset would, but it's really upsetting because i have very important info and conversations with those people, and now they're gone. please help fix this issue.",23,
2025-11-25 19:56:58,1,"The latest update is really very poor. My contacts who used to see my about previously have told me that they're not able to see my about, despite my privacy settings set to my contacts. This has happened only after I updated to the latest update recently. My contacts also use the updated latest version and I'm able to see their About but they can't see mine. I've tried to lodge complain via app too but nobody contacted ever! It's really very disappointing from an app as reputed as whatsapp!!",23,
2025-11-29 23:10:25,1,"FIX. THE. APP. New update sucks. It won't let me share my photos from my gallery anymore. the moment I click my picture then click share then click the group...WhatsApp opens a page about ""your contacts aren't synced"" This was never an issue before. i always easily upload pics from my camera roll to the groups/individuals I had chats with. this just feels like an inconvenience added to force me to give up my privacy and give up all my personal contacts over. I dont ever want to sync my contacts",23,
2025-11-25 11:47:19,2,"Keep getting error. Whatsapp stopped working all of a sudden. Tried reinstalling few times and error still shows up. I have reported the issue and still waiting for a solution. Latest Nov 25, 2025. All of a sudden, whatsapp keeps crashing on S25 Ultra. I have tried clearing cache and restarting my device. Whatsapp version is latest as well.",22,
2025-11-25 11:14:54,5,"To be fair, I did not like the recent update with the user's bio being like in a temporary display. I may be weird but I just love reading bios of myself and others. Should have just remain as it is. Or, make a ""never"" button so that I don't have to modify my bio every single day. Improve this issue and I will give you full rating. Thank you.",21,
2025-11-25 11:42:38,2,"whatsapp is trying to be much better, but I see that you keep adding more problems, what's all this stress you are putting me right now. your updates are just weird, if it won't work perfectly just leave WhatsApp the way it is before, coz I don't know why the app kept running in background and drained my battery, always interrupting my network, this updates ain't working well. do something",21,
2025-11-30 14:53:14,2,"Hey, WhatsApp. In 2 last year, my app was acting weird. Every one month, at least fifth or 10th times, WhatsApp gives me a pop up message, and it shows, ""Something went wrong with your chat history."" If I get lucky, my recent message won't disappear. I've clicked ""daily"" as my automatic update schedule, but it goes nothing. I've made a new account just for backuping my messages, though, and again, it goes nothing. Please read this, and I need you guys to fix this. Warm regards.",21,
2025-11-22 23:06:29,2,WhatsApp used to be very enjoyable but now unnecessary features are being added while important ones are neglected. 1. there is not reason for iphone devices to have more features when compared to android devices. android devices should also have the option to crop the size of videos being posted on statuses or being sent to a recipient. 2. HD quality should also be an option for screenshots that apply high resolutions to the screenshots. this is a feature only accessible to the samsungS series,20,
2025-11-26 05:23:17,1,"Cannot turn off junk notifications. The app incorrectly classifies notifications like ""Hey, you could import your contacts if you really wanted to"" as messages, meaning I can't turn those notifications off without turning everything off. I won't negotiate! Uninstalled. grr!",20,
2025-11-17 22:25:33,2,"needs a bug fix, it asked me to clear cache Because it wouldn't load a video and would shut down as soon as I tried to start a video chat. I even deleted all of one other ongoing group just to clear the cache and make more space and nothing's working. just started today. The app itself is telling me to wait for an update.",19,
2025-11-19 06:24:30,4,"Dear WhatsApp Support Team I recently received a message saying ""This account can no longer use WhatsApp"" I believe this may be a mistake or a misunderstanding. I always try to follow WhatsApp's Terms of Service and use the app only for personal communication. Kindly review my account and Restore access if possible. I would be very grateful for your help and support. Thank you for your time and understanding.❤❤❤ Ban Number :- Country:- Device Type",19,
2025-11-28 15:59:23,1,"They are making it even harder to use without syncing contacts. Even when you try to use wa.me links or share a photo from another app, you are faced with the ""your contacts are not synced"" screen, even though you already have lots of existing chats. I am not even mentioning that solely relying on a contact list is already a fundamental flaw of WhatsApp.",19,
2025-11-23 15:52:59,4,"This app is great and all but when it comes to the channels, some may want to be part of a channel of a language that they do not understand but which to. So, i think there's a need to add a language translator function when it comes to channels on WhatsApp.",18,
2025-11-25 14:11:39,5,"Hi Dev team. I've started using Xiaomi 17 Pro Max 10 days back and Whatsapp is not showing my contacts names all the time. Most of the time in a day, it shows the cell numbers instead of contacts in list and chats but the groups names are unaffected. I am only using my Gmail contacts as primary source in my cell contacts. Can you please help me solve this problem? Thanks for the great work.",18,
2025-11-29 02:48:52,1,"My experience become so bad after the new version of whatsapp that I want to quit it. It was the best app for video calls, voice calls, messages, and sharing images, documents. But now it took 5-10 min to just load and every single time when I open the WhatsApp, the chat loading suddenly pop up and it took nearly 2 minutes to load. I am feeling to quit this app because it took a lot time to just load and render. Make sure to fix this Meta a huge request 🙏 from my side..",17,
2025-11-24 17:46:03,4,"The past month or so, for some reason if I take a picture through the app and try to send it, it doesn't let me press the send button. It just doesn't do anything. If I use my phone camera to take a picture then send it on WhatsApp then it works fine. The app needs an update to fix this bug. Please fix this.",16,
2025-11-25 15:56:27,2,"nice app, but it uncontrollably auto download every single thing!!!! pictures, videos, thousands of them flooding my phone's storage every moments!!! from every chat group from work or friends!!! I tried to unable the media auto download in the setting, even restricted the app's access to my gallery but nothing work!!!! I'm using a Redmi phone btw. Hey Devs, maybe you guys deserve this 2 Star, honestly 🤷🏻‍♂️",16,
2025-11-26 14:15:47,4,I have two different operator numbers because I use them for different purposes. But at WhatsApp we can use one account one number. It will be helpful if we add many accounts at a number. I mean people will send messages to me in different numbers. But I will receive that in the same account and also see that in which number he/she send me messages.,15,
2025-11-27 13:28:58,1,"Custom notification is not working properly, one of my contact's custom notification is not working (still default notification). But the other contact's custom notification worked fine. Please fix this. edit: the app is starting to become spammy. the start chatting section that keeps appearing is extremely annoying",15,
2025-11-25 19:40:19,5,"This is a great app. But the problem I have is that when you are added to a group, you cannot see past messages from that group, only the ones when you entered that you will see. Another problem is that we cannot make voice note on status watched",14,
2025-11-26 04:44:59,1,"The app gets worse and worse every update. There is no reason for the About section to be character limited so much and be on a timer. No one was complaining about it. Also I would like to be able to change how I named myself in my 'You' chat, but I guess WhatsApp can't implement this simple feature either.",14,
2025-11-25 13:21:18,4,My WhatsApp recently unblocked all the contacts that were blocked and when I try to block back it blocks but if you check it unblocks immediately again it's really annoying I really think you guys should look into it because of people's privacy cus the unblocked contacts can view wat ever you do especially if you don't know they have been unblocked. It's really frustrating knowing that people you avoid are intruding into your space. pls it needs to be fixed,13,
2025-11-26 15:23:03,2,"Sometimes WhatsApp just stop responding after texting a long bit and forces the app to stop function automatically. Profile picture Bug(i.e. the circular pic appears square shaped) is so irritating and it is not fixed in past 3 years.(approx). file redundancy is slow, media scrolling sometimes force the app to stop responding.",13,
2025-11-26 21:36:15,5,I love it because you can text your friends and family and you can call them in facetime or not and you have different filters and it's really easy to set up and you can take photos and send them to others and it's the second best app I have installed you guys should try it out for yourself ! please try if you need help setting up you can ask your friend or partner or parents or your nans and grandad you can do it and always try new things and do something and send people message,13,
2025-11-29 09:11:04,5,"WhatsApp is genuinely the most reliable and convenient messaging app I’ve ever used. Fast, secure, and incredibly easy to navigate it keeps me connected with friends, family, and work without any hassle. The voice and video call quality is excellent, and the seamless sync across devices is a lifesaver. Regular updates keep everything smooth and modern. Truly a must-have app. Five stars, well deserved!",13,
2025-11-26 14:09:16,1,What happened to WhatsApp? You could use two IDs at the same time. You could log in to the other account by pressing the switch account button. But now it is not happening and all the conversations in the chat list are being deleted automatically. What is the reason for this?,12,
2025-11-19 08:41:10,1,"Forcing AI on the user is horrible. Not even an option to fully disable it. Even when asked how to hide its icon, we're given directions to toggle off an option in the settings that simply isn't there. You'll remain 1star in my book as long as that icon is on my screen.",11,
2025-11-24 23:59:19,2,"As much as I think WhatsApp has been an invaluable resource I've grown frustrated with it since I started using multi-channel group chats (""communities""). When opening one, it goes to the channel with the most recent message, hitting ""back"" returns you to the main screen, only tapping the community a second time lets you see all the channels. It's incredibly counter intuitive and makes me feel like an idiot going back and forth between chats when opening the desired one should take two taps.",10,
2025-11-27 11:14:49,5,"WhatsApp is an excellent messaging app! It’s fast, reliable, and extremely easy to use. I love how smoothly voice and video calls work, even with slow internet. The interface is clean, and features like chat backups, communities, and disappearing messages make it even better. Truly one of the best communication apps out there—highly recommended!”",10,
2025-11-27 12:31:28,5,"For the past one week. My WhatsApp has been delaying messages from my end. Someone will message me but I will get the message late, even if I sent a message, the receiver will get it, but it will show the messages have not been delivered. I thought it was data, but my Facebook, Instagram and other apps are functioning well. Please, attend to this. Thank you.",10,
2025-11-25 14:20:31,1,"There are many problems with this app now. The main problem is that WhatsApp is banned. I am not using this app against any law. Still, I cannot use this app for more than two days. I get banned after using it for two days, and then it gets fixed within 24 hours. This has been happening to me for two years. I would have accepted all these problems if I had done something outside the rules! But I am suffering so much torture day after day without doing any rull out work.",9,
2025-11-24 21:15:12,1,"I've been trying to contact a business called Tailored Transitions for almost an hour now through this App and I am so frustrated that I'm just going to shut everything down and chalk it up to a wasted hour of my life. I can't believe that there's not an easier way to get a hold of this business besides going through ""What's App"" !!!",7,
2025-11-28 08:49:51,1,"I am extremely disappointed and frustrated to find that my WhatsApp account has suddenly been blocked for “spam.” I am an IT professional, and I have absolutely no idea what so-called spam I’m being accused of. This is shocking and completely unacceptable. My account was working normally, and without any warning it has been restricted. What is happening? I need a clear explanation and immediate resolution. This situation is causing unnecessary inconvenience.",6,
2025-11-28 20:59:33,2,"I haven't seen anyone mention the new update. It's making this look like Instagram; it's annoying that now to add an ""About"" page we have to set a time limit. It's unnecessary; I always have to set the date so it doesn't disappear, but it still resets the next day. tf this happening u guys adding stupid stuff to this app, it getting worse",6,
2025-11-30 01:54:09,3,"The review is a *5-star* rating for a communication app. The user says the app is the best they've used in four years, praising features like creating stickers, statuses, and the “text myself” option to avoid sending messages to the wrong person. The only downside mentioned is receiving an unexpected call from a random stranger, which required blocking. The reviewer highly recommends the app for instant family and friend connections. 👍❤️✨ What would you like to know about this app?",6,
2025-11-30 04:43:58,1,"it used to be good before, after an update, a lot of things changed image sending is more bothering and also ""about"" now only includes 50 characters, and they set default time for ""about"" also, we don't want default time and need more characters to write something, also after deleting WhatsApp, I couldn't able to restore again, when i installed it again all my data and images and chat history everything was gone, so pls take back your new update back, otherwise it gonna be worst app.",6,
2025-11-30 14:28:55,1,"I'm having a serious problem with WhatsApp status uploads. Anytime I try to post a status, it keeps showing “Couldn't send” no matter how many times I retry. My network is fine, storage is enough, and the app is fully updated. I’ve cleared cache, enabled all data permissions, removed restrictions, restarted the app and device, and even tried different networks but nothing works. This issue is clearly from the app and it needs urgent attention. Please fix this problem because it’s affecting me.",6,
2025-11-28 17:35:49,2,"1. The problem with the updates I made a few days ago is that every time I check the status, it starts showing as unseen again. 2. If I set privacy as to how many people can see my status, then after putting the status once, next time in privacy all the contacts automatically get removed from the status show and the contact has to be selected again.👎",5,
2025-11-29 15:58:22,4,"The app is extremely good! it's like easy to use and everything else but I wanna report a bug or glitch it's that when i chat with meta Ai at first when I did everything was good but now from like yesterday it has a glitch a few words, a word or a emoji shows up only when it says anything then after i text anything it goes full on I hope it gets fixed. Thank you.",5,
2025-11-30 04:16:17,4,"Hey WhatsApp, I would really like if you can add an option to turn the blue tick on or off separately, and also a separate option to choose whether I should be counted as someone who viewed my friend’s status. The read receipt setting does both together, but I would like them to be separate. Thank you!",5,
2025-11-26 19:12:33,5,"WhatsApp is a great app that I enjoy using every day. I have a small idea for an update that I think could improve privacy. What if users could set two different display pictures? One DP could be shown only to selected contacts, and the other DP could be shown to everyone else. This would help users control how they present themselves to different people. I believe this feature would make WhatsApp even better. I hope you get my opinion! Thank you for reading my feedback!",4,
2025-11-27 04:38:11,5,Before what app I was struggling to make calls in remote areas where reception signal is very bad you never finished your call and that was annoying too much when you were on a call with a client but everything changed that day when a friend borrowed me his phone to make that call using WhatsApp that was a big change on interference on distraction on cut off and I ending my call without network issues so I was happy with that experience and the advantages when using WhatsApp.,4,
2025-11-29 04:13:04,3,"I have been facing this problem for quite some time now. When I scroll through the chats on this app, it suddenly scrolls too much.Many times when we take a photo from WhatsApp camera and want to send it forward, it automatically rotates it and when we adjust the orientation, it crops the image. This is a big problem.",4,
2025-11-30 06:56:25,5,"WhatsApp has been great since I started using it 2 years ago but I have a request to make crate a provision for uploading voice notes directly to the status. 👌And also introduce game features in chats 🥺 cause I don't use dating apps I don't trust them too, the privacy needs to be more tightened create a space for messages from unsaved contacts the voice calls has been superb of late but the video call crashes at times, I'd like to join BETA THANK YOU WHATSAPP FOR CONNECTING THE WORLD 🎊👋👏",4,
