date,rating,review_text,thumbs_up_count,title
2025-11-27 06:11:33,2,"The app has been recently updated, but the stickers should be treated as emoji, and they shouldn't be shown in the media section of each chat. While scrolling the stickers blink and the User experience is not good. Just image, Video, Document and Links are enough for easy access. Please remove stickers, they are not giving us good experience.",772,
2025-10-23 18:50:35,4,"This is a great app, no annoyance at all, its fast, secure but I noticed something really shocking recently, I believed that if your read receipt is off, the other person whom you are chatting with wouldn't know that you read the message but nahhhh, they can know if they long press on text and select it a small info or details button appears at the top, go there and you'll find out of the person read the text or not. I mean come on, I trusted you 🥲🥲 there goes my excuse of ""I didn't see it""",759,
2025-09-24 02:58:18,2,"I have been trying to enable the voice message transcription feature for months and I'm not able to. The option does pop up in the settings panel but there's no way to save the changes once you select it and it goes back to disabled once you leave that screen. I despise voice messages and I'm not able to listen to then while at work, so it would be a really useful feature for me, but I can't use it.",744,
2025-10-13 03:58:52,1,"It stores all the media on the phone and if you want to remove it (permanently, there's no other way as they don't back it up themselves) is to go chat by chat. Oh, and there's also a useless display while you are doing that: ""What's up takes this tiny amount of space compared to all other apps, just look at it."" Not a single other app on my phone takes as much space, thank you very much. Also, there's an ai button now. I don't need it, I go to this app to chat with people but I can't remove it.",733,
2025-11-18 08:54:56,5,"WhatsApp is an outstanding communication app that delivers fast and reliable messaging at all times. The interface is simple to use, making it easy for anyone to navigate. Voice calls and video calls are extremely clear, even with weaker connections. Features like Status, document sharing, and disappearing messages add even more convenience. I also appreciate the security of end-to-end encryption. Truly the best messaging platform for staying connected worldwide.",733,
2025-11-10 19:54:35,1,"Hate this app. I'm already in, and have been in several group chats, now all of a sudden it needs me to sync my contacts before I can proceed. I don't want to sync unwanted contacts to my app just to continue communicating with the people I've been communicating with for over a year now. I think these ""app permissions"" are more restricting than anything, almost as if to say, ""Give us access to your entire phone's contents if you want to use our app"" and I'm getting tired of it.",717,
2025-10-24 02:57:13,2,"whenever I'm trying to share pictures n try to find it from some folders, it won't let me search them. it used to direct us to open gallery from the app, but now it's like we have limited access. when I clicked ""see more"" it opened cloud media app instead. I allowed all the permission n even tried to clear data, uninstall-install the app but nothing changed. dare I say I'm very disappointed. this has been going on for months. after multiple updates, I think this app worsens.",715,
2025-10-24 03:25:27,2,"Auto downloads every photo that is sent to u in a chat whether u like it or not. If u choose to turn the auto downloadoff, u can no longer view photos sent to you, unless u tap on it which let's u view it but again forces u to download it. You can turn off""media visibility"" which makes the photo not show up in your gallery, but its still being saved to your phone, taking up storage. Such a silly way to overcomplicate such a simple thing. Along with random bloatware features, it just isnt great.",712,
2025-11-17 16:19:15,4,"I still am having challenges creating contacts by categories. When i want to add names to say, Family it does not seem to add them to that specific category. Although i am glad i am able to discard sooo many i had not added. I have read instructions how to figure it all out. Too COMPLEX for me. However, i lack tek savvyness to manifest them. Thank you for giving attention to my challenges.",709,
2025-11-11 19:01:36,1,"Was logged out suddenly with no explanation out of the app and now it won't even start. I've uninstalled it, cleared cache, everything, but it just won't start. And I can't log in anywhere else because of 2fa! WhatsApp please resolve this... Update: it appears all my chat history is gone due to an error retrieving the backup. I just can't believe it. I had the last memories of chats with relatives that are no longer with me there. Things that I will never get back again. I have no words...",696,
2025-11-09 14:31:13,1,"It was great until they forced stored contacts access. They're now forcing you to ""share"" your contacts with them to send pictures, etc to friends when it wasn't necessary before today, 11/9/25. no app needs your contacts to send anything...it should only need the phone number. I'm suspecting they're positioning themselves to sell people's data. So yeah, it was a great app that didn't need much but those days are over. Another bastion of privacy and security has fallen.",695,
2025-10-17 22:22:25,1,"Super annoying that when I want to attach a file, the app doesn't even give me access to all the folders on my device containing media files. It only shows a small subset of my media folders. If I want to send a file located in a different folder I have to locate it in my media gallery, then share to Whatsapp as opposed to just being able to attach it directly from a WhatsApp chat. Really basic feature that they can't even do properly.",680,
2025-10-14 12:17:36,4,"I’d like to share a small idea that could make the app even more convenient for users like me. My husband I share one smartphone but have different WhatsApp numbers. Every time I need to use my own account, I have to uninstall and reinstall the app to log in which wastes data and time. It would be amazing if WhatsApp could allow two accounts to run on the same app, with an easy switch option between them (like just tapping to change profiles). This would be a huge help for",670,
2025-11-20 23:15:30,5,"WhatsApp is a nice social media handle, but there is need to upgrade to ensure information posted or shared is not lost without one's consent. Notice to update to latest version should be given adequate number of days or weeks ahead. Again, updating to the latest version should be made as simple as possible without glitches. I have succeeded to update to the latest version. Finally, WhatsApp has helped me immensely in smooth communication and sharing of information. Thankyou very much.",639,
2025-09-18 06:56:27,2,"I've been using it since like forever and recently they've been closing the app for me due to 'spam' and after requesting a review they review it and open it back. it happened a few times in a row and then now suddenly they closed the app saying I can't use my number I'd have to log into the app as a different person, for what reason I don't know, apparently I haven't been using the app according to their guidelines which is plain rubbish. please sort out your problem",628,
2025-10-31 21:22:49,2,"WhatsApp is a phenomenal messaging app, but I have come across a slight issue that brings me great frustration whenever I try to post on my status. Whenever I go to add the audio feature to a photo or video, it never uploads unto the status. This never occurred when the feature was first introduced, but it has completely frustrated my use of the app. Also, my WiFi is not the issue at all, and the feature is available in my country. Please, fix this issue speedily. Thank you",611,
2025-10-07 21:04:11,4,"I've been using this app for several years and had no problems since 😎 as I said before the app is good and very capable, however it fails to adjust managing dual feed: Wi-Fi and Cellular data. it stalls and sometimes crashes. I tried to set data usage preference many times, but had no success. sometimes messages don't send or will not receive, maybe for the same reason. I will be happy to keep on using WhatsApp, but for now, I'm going to remove one star...",593,
2025-11-08 17:47:04,4,"only 4 stars. I noticed I was not allowed to take screenshots anymore during videocalls with my girlfriend. And no, not ""this"" kind of videocalls, grow up please, just normal calls. Something both of us would do at the end, always, to say goodnight (long distance relationship) Luckily, with the current update, it's back to normal again. PLEASE don't change it again, or at least include a setting that allows you to disable it for specific contacts. Otherwise, LINE offers videocalls aswell.",558,
2025-10-27 21:58:29,5,"it's the best communication app so far and has great features to ease communication. I have just one complain, I don't like the fact that I have to enter a chat before I know if someone is online. it would be nice if you could see who's online without entering the chat and also to be able to see who viewed a message in a group chat. Apart from that it's a very good app",547,
2025-10-24 01:54:39,2,"App works fine for the most part, but anytime one person is on their desktop, the other people on the experience and echo on calls. It seems that WhatsApp removed their echo cancelation feature for desktop, as this hasn't been an issue for other similar apps like zoom and teams. It works fine when everyone is on their phone though. The issue is really annoying please update the app for desktop.",527,
2025-10-24 10:31:45,4,"Great App, I can have two accounts with different numbers in the same app,thats well and good,BUT sometimes I have to go through my chats or settings just to know which account I'm currently switched to. If you could just make it a little bit simple for a user to know which account they are currently chating on,Maybe their profile pic or their number displayed above the chats!!. It will be very helpful. This is still the No.1 Social App.",522,
2025-11-12 17:03:58,3,"My biggest complaint with this app is that while you're reading previous messages to catch up in a conversation, if another person starts typing while you're reading, the entire conversation thread jumps around depending on whether the person is typing or not. This is especially annoying in a group chat. There should just be a space at the bottom of the chat where the typing symbol can appear without being problematic.",458,
2025-11-19 14:07:54,1,"During message forwarding, Whatsapp has kept the option of ""forward to status"" - which is shown as the topmost contact and can be easily selected. But this is ""dangerous"". Many users are facing this issue. Please change its location. Private messages of people are getting shown on status !! Dangerous bug !!",434,
2025-11-11 15:12:19,1,"App got suddenly banned two days ago for messaging a group member. I didn't violate any terms. Support just sends you a generic message to not email but instead request review through the app, even when I told them the request review feature is not working. To rub salt to injury, the feature in the app to request review is crashing every time I try it. This is happening to many people too. Need to wake up before people leave your platform in droves.",424,
2025-10-16 23:25:24,2,"I can't reply to statuses with voice notes. I would record a voice note and press to send it when done only for it to just disappear and never be received by the other contact, even a trace of it ever being recorded is won't be there. Weird enough, when I comment on a status with a written text, it is delivered without any issues. I become confused because the voice note in a chat is recorded and delivered without any issues, so I wonder why an issue would be only when I comment on statuses.",379,
2025-11-11 05:29:11,3,"I've actually enjoyed Whatsapp over a decade. However, the past few days have been frustrating. After the last two updates, it's been crashing repeatedly. It suddenly hangs and I get a prompt either to ""close app or wait"" . I have also attempted some remedial measures by triggering the force stop option but all efforts has been futile. What can be done to resolve this?",370,
2025-11-16 18:29:18,4,"WhatsApp is simply awesome! Fast, smooth, and super easy to use. I love how quickly messages deliver, and the voice/video calls feel crystal clear. The app is lightweight, secure, and perfect for staying connected with friends and family anytime. If you want a reliable and friendly messaging app, WhatsApp is definitely the best choice!",345,
2025-11-21 02:17:13,3,"WhatsApp has always been a great App to help us stay connected to our friends and family, until recently where the broadcast feature of limiting the number of messages on all broadcast lists to 35 in a month, was introduced. Hence, the 3 star rating and not 5. It was very wrong of WhatsApp to get a customer habituated to something and suddenly has to now approach his contacts individually, taking more time and energy. Request you to please bring back the feature with no such limitation. Thanks.",340,
2025-11-28 21:43:06,1,"WhatsApp has become terrible in the last three to four months. Voice messages sound glitchy and robotic, not even close to my real voice. On top of that, I cannot upload photos at all. Every image gets stuck at 80 percent forever. I am forced to send photos as documents which is ridiculous. This is a basic feature and it is broken for months. Fix your app. One star because zero is not possible.",329,
2025-11-16 13:57:05,1,"I can't login to my whatsapp,, Worst app ever. I actually had to buy a new phone and I can't even register back into WhatsApp. When I try to login, it doesn't even send the code to my number and when I try to click on ""Didn't receive a code?"" it just straight up just shows, ""Choose how to verify"" and a Continue option which does nothing. I'm stuck in an infinite loop!!",314,
2025-10-24 14:50:48,3,"Amazing app for messaging, but suddenly, when I updated the app, I could no longer switch accounts. It kept spinning while showing ""Loading....."" I can't do nothing on the app. I have cleared the cache, uninstalled, reinstalled, and restarted my phone with hopes that it would restart the WhatsApp from the beginning, all to no avail. The new updated version needs reworking.",301,
2025-10-31 04:07:17,1,"All the new updates are literally degrading WhatsApp. Personalised ringtones don't work. Images from group don't get saved in mobile once clicked on download. Disappearing messages option is a plus point for those who ill-treat others with derogatory messages. Additionally, the Auto backup also doesn't work. This app used to be so good but now what a misery it is !!!!",292,
2025-11-25 15:20:35,1,"Changing it to 1 star cause it's been 5 months and the option to send a picture or changing profile picture from gallery albums are still nowhere. We can only use cloud media app where not all albums are presented making it hard just to do something so simple. Hope it's going to change back to how it was before sooner rather than later. Or even worse, they're changing the options into another useless ones again.",222,
2025-11-18 05:31:57,3,"WhatsApp is repeatedly showing an option to restore old chats without my consent, and the app starts functioning on its own. After that, an error message appears saying “There was an error restoring your old messages.” Once this happens, all my chats disappear, which is extremely upsetting and inconvenient. Even though I can clearly see that my backup is saved, the app does not restore it. Instead, every time I try, I end up losing all chats, including the most recent ones. Needs attention.",220,
2025-11-28 23:43:50,3,"So far, everything is fully operational. Out of the two stars left, one is for the picture quality. Updates upon updates and the picture quality remains as poor as ever. Even the HD quality doesn't do any better, instead it just increases the size of the media without actually improving the quality. The second star is for a personal issue I've been having alongside few others.. I can't send send voice note replies from statuses. After recording it shows ""sending reply"" and even ""sent"" without.",219,
2025-11-26 06:01:19,1,"This is for the whatsapp app on pc. The whatsapp app on pc is very inconsistent since their 15 November 2026 update. The application keeps on opening and closing by itself, deleting what I type and being incredibly frustrating. I wish they kept it the way it was because it was functioning well in my opinion. I can't deal with the fact that I'm in the middle of work and it decides to open or close by itself",218,
2025-11-23 05:01:30,2,"5-star rating! WhatsApp is perfect for staying connected with friends and family. However, I feel it would be amazing if it supported more Indian languages. Currently, only a few languages like English are available, but India is a diverse country with many languages. Adding more languages would make it even more inclusive. Other than that, the app is top-notch! Great job, WhatsApp! 420 people found this review helpful",210,
2025-11-28 15:15:50,5,"WhatsApp is a fast and reliable messaging app with secure chats, voice/video calls, and an easy-to-use interface. It works smoothly because users can connect through phone numbers. However, this also creates a limitation: you can’t find someone using a user ID. Adding a simple WhatsApp ID system would improve privacy and make it easier to connect without sharing personal phone numbers.",201,
2025-11-18 16:58:29,1,"This silly app almost destroyed my eardrum. I was listening to a voice message, at low volume. Kept the phone close to my ear, not to disturb others around. And at the end of the voice message, an extremely loud end-of-message tone went off! Still pain in my ear, after 10 minutes. What kind of retarded programmer is behind this??",181,
2025-11-17 18:54:54,2,"All pics, videos, and other media files are saved in my internal memory. I cannot chose to have it saved on my sd card. This slows down my phone and eventually will fill up my internal memory. Whatsapp, please update the app and allow us to save data on the sd card!!!",153,
2025-11-19 01:01:28,1,"I've been using WhatsApp for years and it was great, however today they are forcing us to have AI on the app and I can't disable it. If I wanted AI I will use a separate app. Please give us the option to remove it, it's very distracting. It's not just the logo, it also shows up when trying the search bar which makes things worse for WhatsApp users.",151,
2025-11-17 14:29:37,1,"Service for WhatsApp web has been constantly disruptive in the last few months. At first, it required me to scan a QR every 5 days, then decreased to 2 days. and currently its every 2 hours to a day. even though I clearly marked ""remember this device"". One day I opened to find all the messages not showing on WhatsApp web. it disrupted my communications during the morning and wasted a lot of time.",150,
2025-11-23 14:37:58,4,"Love the app. But there's one bug that's been bugging me for a long while. I used to be able to make stickers with the WhatsApp sticker maker, but now whenever I try, it shows ""Failed to create sticker, please try again"". It's been like this for a long time now, and happens with gifs whenever I try to convert them to stickers.",140,
2025-11-23 20:45:57,4,"This app is used on my phone on a daily basis. I love it because it lets me communicate with people far away and it has very good quality calls, texts and voice notes. My only problem really is with the user's About button. I DO NOT LIKE that we only get 50 letters to write our Abouts and I also DONT LIKE EVEN MORE that they changed them from the old ones. Get Whatsapp to bring the old About technology back, it's better than this annoying 50 letter system!!!!!!😡😤😠🤬👺",134,
2025-11-26 12:37:27,1,"On average I'm being logged out of my account close to 10 times a day, and this has been happening for the past three weeks now. The process of having to add my number and log in again and again is now exhausting. I have no idea if the problem is with the app or really there's some hackers out there trying to take over my number. I've tried to reach out for help on the issue only to deal with AI. My problem needs another human not a machine, please.",131,
2025-11-25 03:20:18,3,"I'm a WhatsApp heavy user .. and what I can tell is that if you have another number and u use the dual account.. it doesn't seem to be syncing well. the backup also has some problem as it doesn't allow me to change the time or if it is not suppose to change time, it should have this feature as syncing at 7am is not a good timing as this hour is my traveling time. if u ask, the best time would be 3am when I am sleeping but even when I manually trigger the back up, it doesn't seem to work as smoot",127,
2025-11-15 19:38:27,1,I like whatsapp but i wish we could listen to some live music while talking to anyone. Or maybe we can share live song as well with the person just like discord. Rather than switching to other apps... i think it should have all the lists of songs so thay we can listen to music live. please increase limit of group members.,125,
2025-11-21 07:54:00,1,"delays constantly! usually whatsapp is amazing but lately there's been major delays on calls, calls always disconnecting, chats not sending until half an hour later. and no it doesn't need updating, Ive checked. I sent a text to someone and they received it an hour later. please fix this!! it isn't only me having this issue.",105,
2025-11-13 12:02:45,1,"Always a big issue. Google account not registered anymore, suddenly, after a few weeks. Chat backup can't be saved- actually hard to restored and lost much data already. for a week not syncing, not sending messages, lost history after reinstalled, not recognizing google accounts, not uploading profile picture, anything works. Support zero!!!",101,
2025-11-21 07:03:31,1,"Recently, my account has been banned twice for seemingly unknown reasons and then released without any detailed explanation. This is a terrible user experience and a major inconvenience especially when there's no active recourse and no voice from users. Users aren't even informed what might have triggered the ban, leading to inability to avoid another recurrence.",98,
2025-11-18 20:09:39,1,"1. When I type words in order to post on my status, it does not indicate to me when my words have exceeded 700 words and at that point I delete the extra words but even after I post I find that about a third of my write up is deleted and I find that very annoying. 2. The new updates arrived not welcomed. No need to remove the search bar under status. 3. Why do we have channels? WhatsApp is supposed to be for instant messaging, replacing SMS only and not turned to Instagram or Facebook please.",93,
2025-11-22 11:21:38,2,what's the use of having back ups if they're not gonna work when you need them. I've tried accessing backed up data multiple times and I've only gotten a partial return on those back ups Moreover the status re-sharing feature seems to only work when I lodge a complaint and a few days after I that it disappears again. Honestly getting exhausted of writing these.,89,
2025-11-14 21:57:33,1,"What an unpredictable app, getting my account banned just for messaging a new contact, without me being engaged in spam or in any fraudulent activity. I sent countless emails, for weeks, till now it wasn't resolved. The only response I keep receiving from the mail was that I should message on the app, which I was unable to, because I realized my account was permanently banned for no reason I may later come back to give Whatsapp a better review if my account is back safe and sound.",87,
2025-11-29 20:09:46,1,It doesn't allow me send voice notes or texts through status reply. It deletes my chats and calls don't show until it goes through missed call. Today it went blank and deleted everything and when I reinstalled and tried to restore my back up it showed that it did but there's nothing in my chats only empty groups. and it's the old version and I can't even update it. I am losing my mind important documents and images are gone with no known way to get them back,85,
2025-11-14 13:27:57,1,"I'm utterly annoyed lately because NONE of the thumbnails on shared youtube videos show up on WhatsApp, while on other spaces, they show up immediately. I've tried absolutely everything, all the instructions given on the entire web, even several times over, but nothing works. So, what's the problem? It changed from one day to another without me changing any settings myself. There's gotta be a solution. Obviously, the change came from the app itself since thumbnails show up elsewhere, pls help!",84,
2025-11-20 14:20:25,5,"WhatsApp has been a reliable method of sending and receiving messages across the world, and I'm thankful for the new updates so far. But I recently noticed that my audio reply to a WhatsApp Status does not go through. I've also done everything I could from my end to resolve this issue yet no result. Kindly help me from your end",83,
2025-11-20 18:34:09,1,"Bought a new mobile lately and I SADLY noticed some FRUSTRATING changes on this app. First: the pnly MISERABLE 50 words to put on the status. Instead of TRIPLICATING it, which would allow me to put some chorus of well choiced songs, according to my mood, there's ONLY 50...Also, I noticed that a MASSIVE deal of songs were excluded from status options as well. What's the point here?!Making a ""poor man's"" version of WhatsApp?! BRING THE GOOD AN' OLD VERSION BACK!!!",82,
