date,rating,review_text,thumbs_up_count,title
2026-03-14 06:43:51,5,"शुरुआत🚀💞 में ही समझ गया था ये बहुत तरक्की करेगा क्योंकि ये ईमानदार लगा मुझे और बहुत नम्र,मेहनती और तेज टीम है इनकी 🎻🤟🚀🚀😍😍मैं 2018 से🤩🌻❤️❤️💯💯 Groww से जुड़ा हुआ हूं,,ये BEST 🥰🥰 है,बेहद ईमानदार एप्लीकेशन है 💝💝🤗🤗✅✅✅✅💫 (internal,words )बड़े कीजिए👏👏बहुत ही सरल खूबसूरत और ग्राहक मददगार तेजी से और,,तुरंत सुनवाई करते हैं,,,और वर्किंग टाइम के बाद भी समस्या का समाधान तुरंत करते हैं,,चैट की सुविधा इसको सबसे बेहतरीन बना देती है,,🌹🌹GROWW के चार्जेस हद से ज्यादा हैं,खासकर ईटीएफ में,❌💔",1763,
2026-03-08 10:13:53,5,"Best app for all kinds of investments. In brief, you can do/start SIP's or lumpsums in mutual funds, stocks, ETFs, F&O trading, can see and modify your portfolio anytime, can have all sort of things that an investment app should have. Best One !",400,
2026-03-08 12:13:55,4,Good app for investing in Equity and Mutual Funds. Keep up the good work. Instant withdrawal is very good thanks.,242,
2026-03-09 14:15:02,1,"In this app, I often face technical errors when trying to exit the market, and because I’m unable to exit on time, I end up incurring losses. I also have screenshots of the technical error, but there is no option to attach them here. otherwise, I would have attached them.",158,
2026-03-13 13:07:53,5,This app is best for beginners User friendly interface. The only one issue I was facing since last update is that the full landscape chart display can't work properly. it's load and then suddenly open the home screen 😭😂👍👍 The most impressive thing is that the charges are really minimum. As compared to other apps. 😎🙂..Keep Growing with Groww .🇮🇳,121,
2026-03-12 04:50:16,2,The app was working just fine when they disabled the feature that would let you export the external funds as well. By when can we expect the feature enablement? The dashboard has old data for the portfolio that really doesn't help to track my investments.,110,
2026-03-11 05:49:39,1,As usual groww is not responding,56,
2026-03-11 05:01:32,1,"Biggest Crashed Application ever i have seen, not even a single chart is opening how to enter or exit..i strongly recommend to go with other standard brokers..",43,
2026-03-12 17:33:39,5,user friendly Requesting in next update the stop-loss and target must be set by % (percentage) when we buy at market price.,15,
2026-03-11 00:58:17,1,External fund import is failing. Kindly fix the Customer will choose better option.,12,
2026-03-10 04:46:33,1,Never do option trading in Groww because GTT orders only trade above our price. disappointed groww,7,
2026-03-05 03:03:33,1,"I took trade using pledged amount. It charged 450 to pledge the amount of 45000. I am in a trade but still showing the -7600 cash don't know why if I'm in a trade. Without exiting the trade I added 7700 more amount. After 5 days I booked 5076 profit. But in my cash wallet it is showing 10300 amount. After customer service. 7700+5035 = 12735 - 1000 brokerage = 11735 - 450 = 11285 should show. But it is showing 10300, Grow is worst platform for options, I also found mutual fund withdraw fraud.",6,
2026-03-15 02:58:53,1,Recently what I observed is generally liquid fund takes 1 working day exit but in groww it takes almost 2 to 3 days? what is the reason behind it?,5,
2026-03-07 05:25:23,5,Very easy and good app..Easy interface.. Good customer care service.. Invest & Groww,4,
2026-03-06 05:49:19,1,"My genuine openion is this grow better works on desktop or laptop and mobile app built for just name sake, if switch to another app and comeback to groww it stucked and showing where you left. again close the app and re open then only comes to live.",4,
2026-03-06 01:31:14,4,"it is taking almost 6 days sometime more to update the SIPs, the deduction happens 1st of every month but they continue to show in progress in the dashboard.",4,
2026-03-05 11:18:55,1,"holding shares click too much bad experience, not click open detail i have to click share name particular text name after few update ui/ux is worst then ever.",4,
2026-03-10 07:42:45,1,"One of the most useless apps in terms of mutual fund investment, there is no help from customer service, waiting for a long time does not give any response, please open an account in other apps but never open an account in groww",3,
2026-03-09 15:46:46,2,Many bugs are coming while trading in apps and they are irritating me. please don't encourage me to use other apps. Today apps facing same problem. Why . Today now,3,
2026-03-07 08:42:41,1,"I am trying since many days to import all internal and external Mutual Funds but app is just showing that they will come with new update shortly, but i don't know when new updates will come. Till the time we just have to wait. It is a very disappointing thing in today's digital era customer have to wait so long just to get own funds details. Team request to resolve at earliest",3,
2026-03-07 03:48:59,5,"I find the Groww app simple and easy to use. The interface is clean and straightforward, which makes it good for beginners who are just starting with investing or mutual funds. Navigating between stocks, mutual funds, and other investment options is smooth, and basic data like price charts and performance history loads quickly.",3,
2026-03-06 16:58:36,5,this app is very easy to use for beginners.....there is no software issue.... comparatively very fast and clear.i am using this app for 4 years.. I personally recommend this app to everyone.,3,
2026-03-06 10:15:58,1,There are too many glitches while trading it's start buffering while my trade and that causes too many times losses when I try to exit it get started buffering earlier I am happy with the app but last 2 week this problem has increased too much mns for a trader it's too much the amount of time it buffers my profit of 2500 comes to 1000 i need to restart the app then after also sometimes it buffers 🥲🥲🥲,3,
2026-03-06 04:36:12,5,"I am truly grateful for this app. It is very user-friendly and easy to use. There are many useful features and products available on it, which makes learning and usage very convenient. The design of the app is also very attractive and beautiful. Thank you for creating such a helpful and well-designed application. It is really beneficial for students and users. thank you thank you thank you",3,
2026-03-06 03:32:50,5,Great and very friendly app. compared to other similar apps this is much user friendly and its simplicity makes it a quick decision on trades The app is quite faster and I can see a lot of improvements happening within the app often.,3,
2026-03-06 01:52:01,1,"Terrible experience. Placed a Sensex Call order, but the app glitched and didn't even show the order in my dashboard. I tried to cancel immediately, but the app was unresponsive. It finally 'ghost executed' my order at a much higher price (₹291) when the market had already crashed to ₹256. I have a full screen recording of the app failing to cancel and hiding my active positions. If you value your capital, stay away. I am filing a formal complaint with SEBI SCORES.",3,
2026-03-05 07:52:22,5,one the best app for Futures & Options. easy interface and quick execution.. must try ❤️,3,
2026-03-05 06:30:15,2,"Dear Groww... Please Remove the Stup¡d Effects in latest Update.... ""The Rising Building effect"" is so Non-Sense... it irritates everytime when we go to Check any Stocks Financials.... also wastes 1 - 2 seconds everytime....this is so irritating effect.... Keep the App Simple and Smart.....Not Stup¡d and please remove this non sense thing Asap 🙏🏻🙏🏻🙏🏻🙏🏻🙏🏻🙏🏻",3,
2026-03-05 01:40:54,5,user interface is very convenient to use compared to other brokerage and it's not difficult for new users also. every thing is in detailed and managed the data very well. no annual mentance fee for users. I am very much satisfied with groww.,3,
2026-03-04 17:31:34,1,App is good but my order is not executing timely on both time buy or sell. That is not good in option trading. Option chain is not updating timely and the MACD and Supertrend is not updating accordingly chart pattern or you can say candle making. kindly look into these serious matters to all.,3,
2026-03-04 15:35:59,1,"Fetching External funds Paused, Not sure why it happened and when it will be resumed? we are using groww to track all existing funds in one place,but unfortunately that feature is not working",3,
2026-03-04 03:50:37,1,why new listings stocks not available on app. solve this immediately.,3,
2026-03-03 02:57:17,3,I invested some amount in liquid fund. After somedays I sold my mutual fund units even amount also credited in my account. After sold my units till it is showing that fund even after one week. I hope this small glitches will resolve in soon. Remaining overall app experience is good,3,
2026-03-03 02:22:49,3,this is useful for student to grow and but we have some technic to buy a stock at a right time. for me I think it's useful to start this trade stock market ❤️,3,
2026-03-02 22:46:04,1,"Yesterday, I installed the Groww app and began intraday trading. After buying stocks, I tried to exit my positions but faced an issue with the app. I called customer support and waited about 10 minutes. After a 43 Minute call, she was told that I needed to use a laptop to exit. I realised I would have been in a tough spot if I hadn’t had a laptop available. I also worry about what might have happened if I had invested a larger amount and faced a bigger loss while using the app.",3,
2026-03-02 07:04:21,1,This app has an interesting UI but the problem persists with order execution. I would suggest to settle with better apps for trading and investing. This app could lead to serious financial loss.,3,
2026-03-02 06:44:59,1,very terrible experience for intra day trading if you try to exit from trading at market price they make sure you always get way lower than market price. If market price if 40.09 still they trigger the stoploss which is 40.25,3,
2026-03-02 05:50:13,5,It's the best trading platform where an investor or a trader can be updated themselves. Especially I love this feature very much.,3,
2026-03-13 07:27:24,1,Not a reliable app for trading because of discrepancies/delays encountered during selling & buying stocks. Also high external charges & taxes charged by Groww apart from their brokerage charges.,2,
2026-03-09 06:40:33,5,"I like this app very much, trading is done easily in it, this is a very good Groww app, anyone can trade in it very easily, it has been 2 years since I am using Groww in it, I like this app I have learnt a lot from you. You should also download Groww and use Groww for future. In this you get to know all the details, that is why I like trading in Groww a lot.",2,
2026-03-09 05:19:56,1,"customer care is verey slow, not responding on time, showing wrong data.",2,
2026-03-09 04:02:23,5,I have been using groww for more than 2 years now and haven't faced any issue. It comes with all the features and yet it's completely free. how great is that.,2,
2026-03-08 03:32:19,5,"Good features. Please add short-term timeframes like 5m, 15m, 30m, 1hr, and 4hr, and long-term timeframes like 1 week and 1 month in technical analysis. Also add open interest (OI), pivot levels, and Fibonacci levels for both indices and options. In fundamentals, more depth is required - such as SWOT analysis, insights, forecasts, and ratings.",2,
2026-03-07 12:09:33,4,"Great app with a clean and easy interface for trading. It would be even better if Groww could add Trailing Stop Loss, VWAP indicator, and Volume in the charts. These features are very important for intraday and options traders to make better decisions and manage risk effectively. Hope the Groww team adds these soon!",2,
2026-03-07 03:49:55,5,Fabulous application for investment with Spenldid graphics and helpful approach,2,
2026-03-06 23:40:39,5,"Groww is widely praised for its incredibly intuitive, beginner-friendly interface and seamless, paperless onboarding that makes investing in stocks and mutual funds accessible to everyone. It’s a top-tier choice if you value simplicity, educational resources, and a transparent, commission-free experience.",2,
2026-03-06 07:58:49,5,"excellent, in terms of convenience, easiness and transparency. I find it (GrowW App) as one shop solution for all my investment needs.",2,
2026-03-06 03:38:46,1,"don't use this app for trading because there are so much glitches during trading and you can't exit at the right time when you want because your exit order will be rejected everytime . If you raise the concern to the customer service the will just say sorry for the inconvenience caused, they won't provide any solution to the problem. #stopusinggroww",2,
2026-03-05 16:30:55,1,"Groww team , why you take too long time to give us our money , your application alway go stop when importent time come ,where we want buy or sell , you team not go long if update your rule and working.",2,
2026-03-05 14:17:40,1,One of the worst broker. I palced an order today but my app got a glitch where i was not able to see my open order. I had to keep a safe exit because today was expiry and i got panicked because it was a 3 pm trade. I had to book my loss of 40 points because of this glitch and did not want to lose all my capital. I have screenshots of the trade but the company is not accepting their fault. A similar issue happened with my cousin last week. Deleted this app because of their platform issues.,2,
2026-03-05 09:47:33,2,it's hang too much when we place call put order in intrade। I very disappointed 😞 order can't show on order list immediately it's take refresh too much time ।pls team improve it,2,
2026-03-05 06:48:19,5,"yes, very user friendly, if stock recommendations at support levels and exit level are added it will be an additional information 🙏",2,
2026-03-05 06:34:10,1,worse for scalper trade.while buying always stick at 5-10 percent above market price.,2,
2026-03-05 06:23:12,3,"Groww app good but one option is change buy or sell option delivery intraday MTF please change this option automatically select intraday option, We r need delivery option",2,
2026-03-05 04:20:24,5,"Extremely lucid, designed intelligently, Most Easy share trading App",2,
2026-03-04 16:21:26,1,"Please stay away from this App, they will not allow redemption when you want to redeem your hard earned invested money, they charge huge, without any transparency, they do not allow us to redeem Mutual funds investment when we want to redeem, they will not care if dividends do not get credited to your account even after 10 days, they will say you contact them directly, total scam! Be very careful! Stay Away from this!!",2,
2026-03-04 14:58:09,1,unable to install in one plus tablet 2 don't know what the matter please solve the issue ASAP,2,
2026-03-04 09:56:59,1,Brokerage charges very high . every slow app .,2,
2026-03-04 08:18:00,5,"It is better to display RS of Individual stock Vs Nifty50 also. RSI - Ok, 20DMA, 50DMA, 200DMA, MACD, Pivot price against Support & Resistance - Very nice. Anyhow though charges are more. I feel reasonable. Thanks for the service.",2,
2026-03-04 08:12:21,5,"I have been using this app from a long time, this has been the best among this category. very good app. Has the best features 👌",2,
2026-03-03 08:18:07,5,good interference and easy to use withdrawal was exceptionally faster than any upi apps accurate indexes of global stocks,2,
2026-03-03 08:14:17,5,If I Am Going To Share My Experience On This Application Is Absolutely Better Because While Using This Application I Am Felling Better Experience And Smooth Workflow And Easy To Use So I Am Recommend This Application To Other People's Who are interested to use such applications for same.,2,
2026-03-02 10:44:33,1,"I had a very pathetic experience with Groww. Their stop-loss and target features did not work properly. I would strongly advise others not to trade with Groww based on my experience. If you are in profit and have set a 30-point target, even after the market touches that price (or comes very close, around 10 points away), the system exits the trade early. However, when you are in a loss, the stop-loss works correctly",2,
2026-03-02 10:08:07,4,the app is great. it would have been better and very convenient if there is a price shown for SL and target in F&O.,2,
2026-03-02 09:20:56,1,"fraud app.. when I ordered a stock, they added my order in a queue. because they knew share would be profitable for me.",2,
2026-03-14 13:11:25,4,"App is great but I wonder why you guys stopped ""External Mutual Funds Tracking""? Can you please help us with a timeline like when it'll be live again as it has been a while since it got suspended.",1,
2026-03-14 02:15:40,3,"Nice app, but for Stop Loss (SL) or Take Profit (TP) we have to go back and manually enter the price. For scalping, futures, and options trading, it would be better if there is a direct option where we can simply drag and place the SL or TP on the chart wherever we want. That would be the best feature. Otherwise, the market may reverse quickly within seconds and many people may lose their money. I think this improvement would help your app grow. Please consider improving this point. ☝️",1,
2026-03-13 12:43:24,1,mutual funds are not updating,1,
2026-03-13 10:42:02,5,"Simple interface and easy to use gui, trustable, buying and selling stocks is easy, don't know abt F&O",1,
2026-03-12 14:05:14,4,"The Best 💖 One I wOuLd say, but it deMands RandOM updates AfteR A COupLe Of days. That's why 4 ⭐s, PLease iMpROve it I'LL Review this COmMent !! ThaNKs #GROww 🔵🤍🟢 teaM 🙏🏻😊 • On 12.MaRCH.2026 ....... I'm heRe 🙋 Once Again But , The Last mentiOned issue hasn't ResOLved yet ........ 🤡",1,
2026-03-12 12:02:02,1,"not showing update, and when order executed also not updating. showing app error when we buy 1 time that is taking double time . worst situation. when we contact customer care they are saying different answers . worst performance of app. and not even providing solutions to our problem. service also no1 worst.",1,
2026-03-12 07:11:41,5,"Now i can say this application is best for trading and investment in stocks, commodity, etc.",1,
2026-03-11 18:16:05,4,"Super app with zero AMC charges. But I have only one suggestion, please provide an option to buy stocks on the basis of amount. It only shows quantity, converting into amount takes time and makes some user confused on the conversion. so please work on this to provide 'Amount option while buying stocks'",1,
2026-03-11 07:42:34,5,I can't login to my account.,1,
2026-03-11 04:33:24,1,why tracking and updating the external funds stopped?,1,
2026-03-10 16:30:42,3,sometimes I hack and am unable to order to sell or buy at that time. It needs to work on its smoothness and authenticity.,1,
2026-03-10 16:20:17,1,after using it for almost four years uninstalling it as it has started putting more extra charges along with brokerage shifting to dhan,1,
2026-03-10 09:46:16,1,Rubbish app in terms of network optimization total failure even in 5g this app fails to load pathetic lower your brokerage if you can't provide service,1,
2026-03-10 09:42:56,2,Your option brokerage charges are too high. Application also lagging in profit trades. Unfortunately i have to look for another trading Application.,1,
2026-03-10 09:20:55,1,Today the app crashed & I got 3600 loss because of crashed. Not working the app to sell when I was at profit.. after 2 hour sold the trade at 3600 loss because of grow. third class chart view. wrong information showing in chart. on expiry of nifty opposite direction showing from trading view. when you got loss then showing the perfect chart.,1,
2026-03-10 05:37:01,1,The app say I am very good trading app but he i not a good trading app this app thinking only one our profit not trader profit he say I charge very cheap but very hard charge.one trading charge is 54 rupees.it is cheap price ont cheap price.it is very high price.so i think not good app for trading,1,
2026-03-09 14:37:07,1,"worst app, very high brokerage, and also very worst in order execution , I cancel my order before execution but still that order is executed, worst highly not recommended",1,
2026-03-09 13:47:50,1,"Not at all useful for trading platforms, they are taking tax and other charges from my earned stocks which sucks i am going to uninstall this app for taking taxes in huge amounts .",1,
2026-03-09 12:25:33,3,easy to use but charges and brokerage like. touch sky 🙏,1,
2026-03-09 11:09:45,2,I invest in a new mutual fund scheme.but older folow is visisble.new one is not showing in grow app. i uninstall many times but not updated any more. help me in this particular problem.,1,
2026-03-09 10:14:36,2,App is nice and user friendly but at some critical time to stop the loss or withdraw the profit it stops showing exit button due to this inconvenience it is feeling more than worst. why we will need the exit button after loosing all the money? Dear grow team I have faced this difficulty several time during intraday trading which is the worst ever experience. Please look into the matter and resolve the issue at the earliest to loose many users.,1,
2026-03-09 05:47:06,3,everything works fine but don't know why tracking and updating of external funds is paused.,1,
2026-03-09 03:44:14,5,very very good application and will get full support any time,1,
2026-03-09 03:16:39,3,Fonts are very small ... bug in gtt ( trigger orders )- only few orders are shown under filter- gtt-buy-status open. kindly correct it,1,
2026-03-08 18:13:24,1,ye app bhut bekar or High charges wala hai never use plz ye aapke paiso pe hmesa koi na koi charges katte rhega agar aap beginner hai to account negative kar dega plz never use it....,1,
2026-03-08 14:29:38,5,"the best app for buying selling shares,fix deposits. secure and very well managed.",1,
2026-03-08 12:04:17,3,"Application is all good, but it doesn't have a chart layout saving option on the website version. Login on the website can be made easier as it requires to fill the email, then the password, then OTP and then login password. which is time consuming. Login should be faster and easier. Give login options with OTP and login PIN. Another issue is, it doesn't have a sorting option to arrange stocks with alphabetical orders. In both under the indices tab and under the watchlisted stocks. Thankyou.",1,
2026-03-08 11:41:15,3,I have not been able to check external funds for 2 weeks and when I start any new mutual fund example from next month then they are deducting money from next 2 days instead to next month,1,
2026-03-08 07:54:48,1,Why External fund tracking is off now ?,1,
2026-03-08 07:27:17,5,Easy to invest,1,
2026-03-08 06:54:44,1,Trying to refresh my external mutual fund portfolio but unable to do that in Groww app... Kindly resolve this issue at earliest otherwise I will shift my account to other broker.,1,
2026-03-08 03:52:53,5,Great app to trade on. Very informative and user friendly.,1,
2026-03-07 14:50:09,1,"if anyone draw levels in various stocks in one mobile and after changing the phone on same account there is no drawings on those stocks. so you have to redraw those levels, it should be changed in recent update so we have to work easily",1,
2026-03-07 11:33:50,1,"poor customer service. despite customer service excepting glitch in their tool which impacted me to revise my orders and made loss, Customer service is not ready to compensate and gives a stupid response.",1,
2026-03-07 04:25:25,1,Fund status is not getting refreshed and has been paused.,1,
2026-03-07 04:08:26,5,good performance 👍,1,
2026-03-07 04:08:04,5,good,1,
2026-03-07 04:07:20,5,Easy App to understand markets quickly,1,
2026-03-07 04:05:16,5,wowwwwwwwww,1,
2026-03-07 03:52:23,5,easy to understand,1,
2026-03-07 03:51:35,5,Good trading app and easy to create account🙏,1,
2026-03-07 03:39:08,5,I Requested Groww Daily SIP System,1,
2026-03-07 03:33:31,5,good,1,
2026-03-07 03:32:56,1,This app is good but something more Some more systems need to be introduced.,1,
2026-03-07 03:31:35,5,good,1,
2026-03-07 03:28:41,5,nice,1,
2026-03-07 03:01:46,5,better,1,
2026-03-06 16:57:05,1,I tried to contact support through chat and they don't even respond. Not appreciated at all.,1,
2026-03-06 14:50:46,1,"too much taxes and sometimes you won't know why your balance gets negative even though no transactions were done , u also need to invest on lot of shares to earn profit because of the taxes they cut",1,
2026-03-06 12:02:35,3,customer service calls have wait time for 5 + minutes. post that line just disconnects automatically. the mutual fund NAV refresh does not work for weeks now and no update on when and how will it be fixed,1,
2026-03-06 10:22:38,2,facing technical glitches while exiting when every second is important kindly correct it immediately...,1,
2026-03-06 10:01:41,1,This Is worst app For Option Trading Order Doesn't Execute Proper Glitch Problem.Always Results In losses 😡,1,
2026-03-06 09:39:55,5,Smooth and easy to invest with an intuitive UI. Well designed,1,
